{
  "episodeId": "2026-03-07-news-04",
  "meta": {
    "category": "daily_news",
    "genre": "tech_ai",
    "subject": "テクノロジー・AI政策",
    "title": "政府、AI事業者ガイドライン改定案を公表",
    "subtitle": "ディープフェイク対策は企業に何を求めるのか？",
    "estimatedMinutes": 16,
    "difficulty": 3,
    "date": "2026.03.07"
  },
  "characters": {
    "teacher": {
      "name": "ゾルク博士"
    },
    "student": {
      "name": "ピノ"
    }
  },
  "learningPhase": [
    {
      "speaker": "teacher",
      "text": "まず今日の重要ニュースから説明しよう。総務省と経済産業省が、AI事業者ガイドラインの改定案を公表し、ディープフェイク対策をより具体化した。"
    },
    {
      "speaker": "student",
      "text": "それって、どういうことですか？ これまでのルールと何が違うんですか？"
    },
    {
      "speaker": "teacher",
      "text": "要するに、生成AIの利用が広がる中で、偽画像・偽音声による被害を減らすため、企業に“事前対策と説明責任”をより強く求める方向に進んだということだ。",
      "supplement": {
        "type": "info",
        "content": "ディープフェイク: AIで作られた本物そっくりの画像・音声・動画。詐欺やなりすましに悪用されるリスクがある。"
      }
    },
    {
      "speaker": "student",
      "text": "なるほど、AIそのものを禁止するんじゃなくて、悪用を減らす仕組みを求めるんですね。"
    },
    {
      "speaker": "teacher",
      "text": "その理解でよい。改定案の柱は3つだ。①リスク評価の実施、②生成物がAI由来だと分かる表示や透かし、③問題発生時の通報・是正フローの整備だ。"
    },
    {
      "speaker": "student",
      "text": "“透かし”って、画像の隅に文字を入れるみたいなものですか？"
    },
    {
      "speaker": "teacher",
      "text": "可視のラベルだけでなく、メタデータや電子署名のような機械判定しやすい方法も含まれる。重要なのは、人にもシステムにも判別可能にすることだ。",
      "supplement": {
        "type": "data",
        "content": "判別手段は大きく2系統: 人が目で確認する表示（ラベル）と、システムが検証する埋め込み情報（メタデータ等）。"
      }
    },
    {
      "speaker": "student",
      "text": "つまり、SNSやニュースサイト側でもチェックしやすくなるわけですね。"
    },
    {
      "speaker": "teacher",
      "text": "その通りだ。さらに改定案では、開発企業だけでなく、導入企業やプラットフォーム運営者にも役割分担が示されている。"
    },
    {
      "speaker": "student",
      "text": "AIを作る会社だけの話じゃないんですね。使う側にも責任があると。"
    },
    {
      "speaker": "teacher",
      "text": "重要なのはサプライチェーン全体での管理だ。たとえば、社内で生成AIを使う企業は、利用目的の制限、ログ管理、従業員教育を求められる。",
      "supplement": {
        "type": "warning",
        "content": "無制限に社外データを入力すると、機密情報の漏えいや著作権侵害のリスクが高まる。"
      }
    },
    {
      "speaker": "student",
      "text": "ログ管理って、誰がいつ何を生成したか残すってことですか？"
    },
    {
      "speaker": "teacher",
      "text": "そうだ。事故が起きたときに原因を追跡できる。これは“説明責任”の基盤になる。"
    },
    {
      "speaker": "student",
      "text": "でも、対策を増やすと開発スピードが落ちませんか？"
    },
    {
      "speaker": "teacher",
      "text": "短期的には負荷が増える。しかし長期では、信頼がないAIサービスは市場で採用されにくい。要するに安全対策はコストであり投資でもある。"
    },
    {
      "speaker": "student",
      "text": "なるほど、守りながら普及させるための改定なんですね。"
    },
    {
      "speaker": "teacher",
      "text": "その視点が重要だ。今回の改定案は法的な強制だけでなく、企業の自主的なガバナンスを促す“実務指針”としての性格が強い。",
      "supplement": {
        "type": "quote",
        "content": "ガイドラインは最低限の共通ルールを示し、現場では業種ごとに具体的な運用へ落とし込む必要がある。"
      }
    },
    {
      "speaker": "student",
      "text": "つまり〜ということですか？ 国の指針を土台に、企業ごとに社内ルールを作るのが次のステップなんですね。"
    },
    {
      "speaker": "teacher",
      "text": "正確だ。AI時代は、性能だけでなく“安全設計と運用体制”が競争力になる。では確認テストに移るぞ。"
    }
  ],
  "testPhase": {
    "confirm": [
      {
        "question": "今回のガイドライン改定案で、特に強化された論点として最も適切なのはどれ？",
        "choices": [
          {
            "id": "a",
            "text": "紙の申請書の様式統一"
          },
          {
            "id": "b",
            "text": "ディープフェイク対策と説明責任"
          },
          {
            "id": "c",
            "text": "AIの研究開発を全面禁止"
          },
          {
            "id": "d",
            "text": "国内SNSの運営停止"
          }
        ],
        "correctId": "b",
        "explanation": "改定案の中心は、生成AIの悪用リスクに対応するためのディープフェイク対策と、企業の説明責任の強化である。"
      },
      {
        "question": "ニュース中で示された“判別しやすくする工夫”の例として正しいものはどれ？",
        "choices": [
          {
            "id": "a",
            "text": "AI生成物を必ず白黒化する"
          },
          {
            "id": "b",
            "text": "生成履歴をすべて公開掲示板に投稿する"
          },
          {
            "id": "c",
            "text": "ラベル表示やメタデータ埋め込みを使う"
          }
        ],
        "correctId": "c",
        "explanation": "人が見るラベルと、システムが読むメタデータの両方を使うことで、AI生成物を判別しやすくする考え方が示された。"
      },
      {
        "question": "ゾルク博士の説明に基づく“導入企業側”の対応として適切なのはどれ？",
        "choices": [
          {
            "id": "a",
            "text": "利用目的の制限・ログ管理・従業員教育を整える"
          },
          {
            "id": "b",
            "text": "AI利用の記録を残さない"
          },
          {
            "id": "c",
            "text": "生成物の確認を個人判断に任せる"
          },
          {
            "id": "d",
            "text": "問題発生時の窓口を設置しない"
          }
        ],
        "correctId": "a",
        "explanation": "開発企業だけでなく導入企業にも運用管理が求められ、利用目的の明確化・ログ管理・教育が重要だ。"
      }
    ],
    "explore": [
      {
        "sentence": "改定案では、{{blank1}}対策として、AI生成物に{{blank2}}やメタデータを付与する考え方が示された。",
        "answers": {
          "blank1": "ディープフェイク",
          "blank2": "ラベル表示"
        },
        "wordBank": [
          "ディープフェイク",
          "バックアップ",
          "ラベル表示",
          "紙資料",
          "メタデータ",
          "手書き署名",
          "認証ログ",
          "VPN"
        ],
        "explanation": "判別可能性を高めるために、可視ラベルと機械可読情報の両面を使うのがポイント。"
      },
      {
        "sentence": "AIの社会実装では、性能向上だけでなく{{blank1}}と{{blank2}}の整備が競争力につながる。",
        "answers": {
          "blank1": "安全設計",
          "blank2": "運用体制"
        },
        "wordBank": [
          "安全設計",
          "運用体制",
          "価格競争",
          "広告在庫",
          "在庫回転",
          "社食制度",
          "来客数",
          "販促POP"
        ],
        "explanation": "ニュースの核心は、AIを“使える技術”にするには、ガバナンスを含む運用設計が不可欠という点だ。"
      }
    ]
  }
}
