{
  "episodeId": "2026-03-04-news-02",
  "meta": {
    "category": "daily_news",
    "subject": "エンタメ・メディア",
    "title": "日テレ、King & Prince冠番組『キントレ』を3月いっぱいで終了へ",
    "subtitle": "春の“改編”で番組が入れ替わるのはなぜ？",
    "estimatedMinutes": 15,
    "difficulty": 2,
    "date": "2026.03.04",
    "genre": "entertainment_culture"
  },
  "characters": {
    "teacher": {
      "name": "ゾルク博士"
    },
    "student": {
      "name": "ピノ"
    }
  },
  "learningPhase": [
    {
      "speaker": "teacher",
      "text": "ピノ、地球観測ステーションに新しいログが入った。日本テレビが、King & Princeの冠番組『キントレ』を3月いっぱいで放送終了すると発表した。"
    },
    {
      "speaker": "student",
      "text": "えっ、番組って急に終わるんですか？ それって、どういうことですか？"
    },
    {
      "speaker": "teacher",
      "text": "まず用語から説明しよう。「改編」だ。テレビ局が、4月や10月などの節目に番組表（タイムテーブル）を組み替えることを指す。"
    },
    {
      "speaker": "teacher",
      "text": "今回の発表は「4月期改編説明会」で出た。これは、次のシーズンの編成方針や新番組をメディア向けに説明する場だ。",
      "supplement": {
        "type": "info",
        "content": "改編説明会＝次の期（例：4月期）の番組編成を発表・説明する場"
      }
    },
    {
      "speaker": "student",
      "text": "なるほど…4月の入れ替えに向けて、いろいろ発表する会なんですね。"
    },
    {
      "speaker": "teacher",
      "text": "その通りだ。次に「冠番組」。特定のタレントやグループの名前・存在を看板にしたレギュラー番組のことだ。"
    },
    {
      "speaker": "student",
      "text": "看板みたいに“この人たちの番組です！”って分かるやつですね。"
    },
    {
      "speaker": "teacher",
      "text": "要するにそうだ。『キントレ』は土曜の昼の枠で放送されてきた。番組の中身は、出演者が“お金の感覚や知識”を体を張って学ぶ、経済バラエティーとして知られている。"
    },
    {
      "speaker": "student",
      "text": "エンタメなのに“経済”なんですね。社会人っぽい…！"
    },
    {
      "speaker": "teacher",
      "text": "ポイントはここだ。エンタメ番組でも、視聴者の関心（生活・お金・買い物）を取り込む設計になっている。だから企業にとっても広告枠として意味がある。"
    },
    {
      "speaker": "student",
      "text": "じゃあ、人気があるのに終わる…みたいなこともありえるんですか？"
    },
    {
      "speaker": "teacher",
      "text": "いい質問だ。今回、局側は「終わる理由は一つではなく総合判断だが、新しく始めたいものがあるから入れ替えが起きる」という趣旨で説明している。"
    },
    {
      "speaker": "teacher",
      "text": "因果関係で言う。①新しい番組・狙う視聴者層を設定する → ②そのために枠を確保する → ③結果として、既存番組が終了または枠移動する——という流れだ。",
      "supplement": {
        "type": "info",
        "content": "改編の基本ロジック：新企画を始めるために、枠を再配分する（総合判断）"
      }
    },
    {
      "speaker": "student",
      "text": "“終わる＝失敗”って決めつけちゃダメなんですね…。"
    },
    {
      "speaker": "teacher",
      "text": "その通りだ。さらに今回、後番組は「サタバリュ」枠として週替わりでバラエティー番組を放送するとされている。固定のレギュラーより“実験”がしやすい形だ。"
    },
    {
      "speaker": "student",
      "text": "週替わりってことは、テスト運用みたいに反応を見て当たりを探す感じですか？"
    },
    {
      "speaker": "teacher",
      "text": "概ねそうだ。テレビ局は、視聴率だけでなく配信展開、スポンサーの相性、話題性、編成全体のバランスも見る。改編は“番組単体”ではなく“ポートフォリオ”の調整だ。"
    },
    {
      "speaker": "student",
      "text": "なるほど、会社の事業入れ替えと似てますね。枠も資源ってことか…。"
    },
    {
      "speaker": "teacher",
      "text": "要するに、メディアの意思決定を読むには『改編』『枠』『総合判断』の3点が鍵だ。では確認テストに移るぞ。"
    }
  ],
  "testPhase": {
    "confirm": [
      {
        "question": "今回発表された『キントレ』に関する内容として正しいのはどれ？",
        "choices": [
          {
            "id": "a",
            "text": "3月いっぱいで放送を終了する"
          },
          {
            "id": "b",
            "text": "放送時間が深夜帯に移動する"
          },
          {
            "id": "c",
            "text": "番組名を変えて同じ枠で続く"
          },
          {
            "id": "d",
            "text": "映画として劇場公開に切り替える"
          }
        ],
        "explanation": "日本テレビは4月期の改編説明会で、土曜昼の冠番組『キントレ』が3月いっぱいで放送終了すると発表した。",
        "correctId": "a"
      },
      {
        "question": "「改編説明会」の説明として最も適切なのはどれ？",
        "choices": [
          {
            "id": "a",
            "text": "次の期の番組編成（新番組や枠の方針）を説明する場"
          },
          {
            "id": "b",
            "text": "番組出演者が謝罪するための会見"
          },
          {
            "id": "c",
            "text": "視聴者投票で番組を決めるイベント"
          },
          {
            "id": "d",
            "text": "番組の撮影現場を一般公開する見学会"
          }
        ],
        "explanation": "改編説明会は、4月期など次シーズンの番組編成方針をメディア向けに説明する場を指す。",
        "correctId": "a"
      },
      {
        "question": "記事で示された後番組（後の編成）の説明として正しいのはどれ？",
        "choices": [
          {
            "id": "a",
            "text": "『サタバリュ』枠として週替わりでバラエティー番組を放送する"
          },
          {
            "id": "b",
            "text": "同じ出演者で『キントレ』を続ける"
          },
          {
            "id": "c",
            "text": "音楽番組だけを毎週固定で放送する"
          },
          {
            "id": "d",
            "text": "ニュース番組に全面的に切り替える"
          }
        ],
        "explanation": "後番組は「サタバリュ」枠として、週替わりでバラエティー番組を放送するとされている。",
        "correctId": "a"
      }
    ],
    "explore": [
      {
        "sentence": "{{blank1}}は、{{blank2}}で『キントレ』が{{blank3}}いっぱいで放送終了すると発表した。",
        "answers": {
          "blank1": "日本テレビ",
          "blank2": "4月期改編説明会",
          "blank3": "3月"
        },
        "wordBank": [
          "日本テレビ",
          "NHK",
          "テレビ朝日",
          "4月期改編説明会",
          "記者会見",
          "株主総会",
          "3月",
          "6月",
          "12月",
          "毎週"
        ],
        "explanation": "発表の場（4月期改編説明会）と、終了時期（3月いっぱい）がポイントだ。"
      },
      {
        "sentence": "テレビの{{blank1}}では、新しく始めたい番組のために{{blank2}}を確保し、結果として既存番組が終了することがある。",
        "answers": {
          "blank1": "改編",
          "blank2": "枠"
        },
        "wordBank": [
          "改編",
          "再放送",
          "収録",
          "枠",
          "衣装",
          "台本",
          "通信費",
          "出演料",
          "字幕",
          "編集"
        ],
        "explanation": "改編は、編成全体の資源配分（枠の再配分）として行われる。"
      }
    ]
  }
}